{
  "schema_version": "0.1.0",
  "generated_at": "2026-07-18T21:18:03Z",
  "worlds": [
    {
      "id": "world-jujutsu-kaisen",
      "label": "Jujutsu Kaisen",
      "work_title": "Jujutsu Kaisen",
      "creator": "Gege Akutami",
      "medium": "manga",
      "first_publication_year": 2018,
      "original_summary": "A comparative reference for studying specialist hazard work, individualized combat capability, institutional training, and the conversion of human distress into supernatural danger. This summary is original analysis, not copied lore.",
      "sources": [
        {
          "url": "https://www.viz.com/jujutsu-kaisen",
          "source_title": "Jujutsu Kaisen official series page",
          "publisher": "VIZ Media",
          "evidence_type": "official_publisher",
          "accessed_at": "2026-07-18T21:18:03Z",
          "verification_status": "metadata_only",
          "license_scope": "Official reference page; metadata and editorial comparison only.",
          "rights_reviewed_at": "2026-07-18",
          "review_reference": "docs/fiction-world-intelligence-architecture.md#rights-and-provenance"
        }
      ],
      "rights": {
        "tier": "editorial_reference",
        "allowed_uses": ["factual identification", "comparative criticism", "original abstract pattern analysis"],
        "blocked_uses": ["copied lore text", "franchise terminology in Arcanea canon", "character or technique imitation"],
        "notes": "Names and source-specific expression remain external reference material and never become Arcanea entities."
      }
    },
    {
      "id": "world-harry-potter",
      "label": "Harry Potter",
      "work_title": "Harry Potter series",
      "creator": "J. K. Rowling",
      "medium": "novel",
      "first_publication_year": 1997,
      "original_summary": "A comparative reference for the social power of school belonging, cohort identity, progressive education, hidden-world adjacency, and the tension between childhood wonder and institutional failure. This is original analysis.",
      "sources": [
        {
          "url": "https://www.jkrowling.com/book/harry-potter-philosophers-stone/",
          "source_title": "Harry Potter and the Philosopher's Stone official book page",
          "publisher": "J. K. Rowling official site",
          "evidence_type": "official_creator",
          "accessed_at": "2026-07-18T21:18:03Z",
          "verification_status": "metadata_only",
          "license_scope": "Official reference page; metadata and editorial comparison only.",
          "rights_reviewed_at": "2026-07-18",
          "review_reference": "docs/fiction-world-intelligence-architecture.md#rights-and-provenance"
        }
      ],
      "rights": {
        "tier": "editorial_reference",
        "allowed_uses": ["factual identification", "comparative criticism", "original abstract pattern analysis"],
        "blocked_uses": ["copied school structures", "copied spells or artifacts", "franchise names used as Arcanea product labels"],
        "notes": "The Atlas may explain why the institution works for readers but cannot reproduce its distinctive expression."
      }
    },
    {
      "id": "world-inheritance-cycle",
      "label": "The Inheritance Cycle",
      "work_title": "The Inheritance Cycle",
      "creator": "Christopher Paolini",
      "medium": "novel",
      "first_publication_year": 2002,
      "original_summary": "A comparative reference for reciprocal human-dragon bonds, shared risk, interspecies ethics, inherited institutions, and the emotional cost of power that depends on another free being. This is original analysis.",
      "sources": [
        {
          "url": "https://www.paolini.net/biographies/christopher-paolini-full/inheritance-cycle/",
          "source_title": "The Inheritance Cycle creator reference page",
          "publisher": "Paolini.net",
          "evidence_type": "official_creator",
          "accessed_at": "2026-07-18T21:18:03Z",
          "verification_status": "metadata_only",
          "license_scope": "Creator reference page; metadata and editorial comparison only.",
          "rights_reviewed_at": "2026-07-18",
          "review_reference": "docs/fiction-world-intelligence-architecture.md#rights-and-provenance"
        }
      ],
      "rights": {
        "tier": "editorial_reference",
        "allowed_uses": ["factual identification", "comparative criticism", "original abstract pattern analysis"],
        "blocked_uses": ["copied bond rules", "copied organizations or languages", "character and plot imitation"],
        "notes": "Arcanea may study reciprocal bond appeal while using its own dragons, institutions, costs, history, and language."
      }
    }
  ],
  "patterns": [
    {
      "id": "pattern-hazard-profession",
      "label": "Hazard as profession",
      "kind": "social_role",
      "definition": "A society turns an invisible supernatural danger into trained fieldwork with recruitment, doctrine, triage, rank, casualties, politics, and competing ideas about what protection permits.",
      "human_appeal": "The character gains a legible identity and peer culture while every assignment tests whether the institution deserves loyalty.",
      "mechanics": ["hazard detection", "specialized response teams", "individual capability", "institutional doctrine", "visible personal cost"],
      "example_worlds": ["world-jujutsu-kaisen"],
      "expression_exclusions": ["Do not copy source-specific energy, technique, domain, clan, school, costume, or rank vocabulary."]
    },
    {
      "id": "pattern-school-belonging",
      "label": "School as belonging machine",
      "kind": "institution",
      "definition": "Education becomes a social world: cohorts, mentors, rivalries, rooms, ceremonies, rules, inherited prejudice, and private places where students decide who they are beyond the curriculum.",
      "human_appeal": "Readers receive both a home and a pressure chamber, with recurring places and relationships that make growth emotionally measurable.",
      "mechanics": ["cohort identity", "mentor access", "progressive mastery", "institutional secrets", "peer rivalry and loyalty"],
      "example_worlds": ["world-harry-potter"],
      "expression_exclusions": ["Do not copy sorting rituals, house stereotypes, point systems, school sports, architecture, artifacts, or spell vocabulary."]
    },
    {
      "id": "pattern-reciprocal-dragon-bond",
      "label": "Reciprocal sovereign bond",
      "kind": "bond",
      "definition": "Power emerges from an enduring bond between two self-directed beings. Neither is equipment; consent, disagreement, vulnerability, shared consequence, and unequal lifespans shape every use of power.",
      "human_appeal": "The fantasy of exceptional partnership is balanced by intimacy, obligation, and the risk of losing someone who can refuse you.",
      "mechanics": ["mutual consent", "shared consequence", "asymmetric knowledge", "bond-specific capability", "conflict between partners"],
      "example_worlds": ["world-inheritance-cycle"],
      "expression_exclusions": ["Do not copy source-specific telepathy, language, rider order, artifacts, political history, or plot sequence."]
    }
  ],
  "benchmark_dimensions": [
    {
      "id": "benchmark-spoken-identity",
      "label": "Spoken identity",
      "layer": "language",
      "evaluation_question": "Can a character claim, fear, mock, teach, or whisper the term naturally without stopping to explain the lore document behind it?",
      "failure_signals": ["modifier stacks", "technical substrate language", "every culture using the same register", "a label that only works as a heading"],
      "evidence_required": ["read-aloud transcript", "dialogue examples across at least three social registers", "inflection and plural forms"]
    },
    {
      "id": "benchmark-linguistic-depth",
      "label": "Linguistic depth",
      "layer": "language",
      "evaluation_question": "Does the term belong to a documented word family, culture, historical change, and speech community rather than a random fantasy syllable generator?",
      "failure_signals": ["fake etymology added after selection", "repeated pseudo-Latin suffixes", "random apostrophes", "identical phonology across unrelated cultures"],
      "evidence_required": ["root and sound rules", "formal and spoken variants", "speaker map", "collision research"]
    },
    {
      "id": "benchmark-character-choice-pressure",
      "label": "Character choice pressure",
      "layer": "character",
      "evaluation_question": "Does the world system force decisions that reveal this character, or does the character merely demonstrate mechanics and carry exposition?",
      "failure_signals": ["occupation replacing personality", "mandatory trauma used as depth", "power solves the same problem every time", "choices without relationship cost"],
      "evidence_required": ["three pressure scenes", "at least one costly refusal", "relationship change caused by a decision"]
    },
    {
      "id": "benchmark-social-embedding",
      "label": "Social embedding",
      "layer": "world",
      "evaluation_question": "If this power or institution exists, can we see its effects on work, law, status, education, family, crime, medicine, faith, and ordinary language?",
      "failure_signals": ["magic exists only during fights", "institutions without budgets or incentives", "ordinary people have no opinion", "identical rules across every place"],
      "evidence_required": ["stakeholder map", "one ordinary-life scene", "one institutional conflict", "one unintended economic or legal consequence"]
    },
    {
      "id": "benchmark-progression-payoff",
      "label": "Progression payoff",
      "layer": "narrative",
      "evaluation_question": "Does each threshold change what the character can attempt, what others expect, and which moral problem becomes unavoidable?",